{"$defs":{"CausalDigest":{"pattern":"^[0-9a-f]{64}$","type":"string"},"ContentID":{"pattern":"^[0-9a-f]{64}$","type":"string"},"bounded_utf8_registry_string":{"maxLength":128,"minLength":1,"type":"string"},"bounded_utf8_registry_string_256":{"maxLength":256,"minLength":1,"type":"string"},"i128s":{"pattern":"^(0|-?[1-9][0-9]*)$","type":"string"},"rfc3339_full_date":{"pattern":"^[0-9]{4}-[0-9]{2}-[0-9]{2}$","type":"string"},"rfc3339_ns_utc":{"pattern":"^[0-9]{4}-[0-9]{2}-[0-9]{2}T[0-9]{2}:[0-9]{2}:[0-9]{2}\\.[0-9]{9}Z$","type":"string"},"safe_relative_path":{"pattern":"^(?![A-Za-z]:)(?!/)(?!\\.{1,2}(?:/|$))(?!.*(?:/\\.{1,2})(?:/|$))(?!.*//)[^/\\\\:\\x00]+(?:/[^/\\\\:\\x00]+)*$","type":"string"},"sha256":{"pattern":"^[0-9a-f]{64}$","type":"string"},"sq18s":{"pattern":"^(0|-?[1-9][0-9]*)$","type":"string"},"u64s":{"pattern":"^(0|[1-9][0-9]*)$","type":"string"},"uints":{"pattern":"^(0|[1-9][0-9]*)$","type":"string"},"uq18s":{"pattern":"^(0|[1-9][0-9]*)$","type":"string"}},"$id":"urn:build-finance:contract:raw-event:v1","$schema":"https://json-schema.org/draft/2020-12/schema","additionalProperties":false,"properties":{"admission_sequence":{"$ref":"#/$defs/u64s"},"base_decimals":{"maximum":18,"minimum":0,"type":"integer"},"base_mint":{"$ref":"#/$defs/bounded_utf8_registry_string"},"equal_time_group":{"$ref":"#/$defs/u64s"},"event_id":{"$ref":"#/$defs/ContentID"},"event_kind":{"enum":["ROUTE_QUOTE","SWAP_OBSERVATION","LIQUIDITY_SNAPSHOT","SESSION_BOUNDARY"]},"event_time":{"anyOf":[{"$ref":"#/$defs/rfc3339_ns_utc"},{"type":"null"}]},"executable":{"type":"boolean"},"fixture_manifest_sha256":{"$ref":"#/$defs/ContentID"},"ingest_sequence":{"$ref":"#/$defs/u64s"},"ingested_at":{"$ref":"#/$defs/rfc3339_ns_utc"},"market":{"additionalProperties":false,"properties":{"base_amount_atoms":{"$ref":"#/$defs/u64s"},"liquidity_quote_atoms":{"$ref":"#/$defs/u64s"},"priority_fee_quote_atoms":{"$ref":"#/$defs/u64s"},"quote_amount_atoms":{"$ref":"#/$defs/u64s"},"route_capacity_base_atoms":{"$ref":"#/$defs/u64s"},"route_impact_bps":{"maximum":1000000,"minimum":0,"type":"integer"},"venue_fee_quote_atoms":{"$ref":"#/$defs/u64s"}},"required":["base_amount_atoms","quote_amount_atoms","route_capacity_base_atoms","liquidity_quote_atoms","venue_fee_quote_atoms","priority_fee_quote_atoms","route_impact_bps"],"type":"object"},"market_id":{"$ref":"#/$defs/bounded_utf8_registry_string"},"network":{"const":"solana-mainnet"},"observed_at":{"$ref":"#/$defs/rfc3339_ns_utc"},"quality_flags":{"items":{"enum":["GAP_BEFORE","MISSING_EVENT_TIME","NON_EXECUTABLE","PROVIDER_REVISION","RETRACTED_SOURCE","STALE_SOURCE"]},"maxItems":6,"type":"array","uniqueItems":true},"quote_decimals":{"maximum":18,"minimum":0,"type":"integer"},"quote_mint":{"$ref":"#/$defs/bounded_utf8_registry_string"},"raw_payload_sha256":{"$ref":"#/$defs/sha256"},"replay_clock_ns":{"$ref":"#/$defs/u64s"},"revision":{"additionalProperties":false,"properties":{"availability_admission_sequence":{"$ref":"#/$defs/u64s"},"availability_slot":{"$ref":"#/$defs/u64s"},"kind":{"enum":["ORIGINAL","CORRECTION","RETRACTION"]},"retracts_event_id":{"anyOf":[{"$ref":"#/$defs/ContentID"},{"type":"null"}]},"supersedes_event_id":{"anyOf":[{"$ref":"#/$defs/ContentID"},{"type":"null"}]}},"required":["kind","supersedes_event_id","retracts_event_id","availability_slot","availability_admission_sequence"],"type":"object"},"schema":{"const":"trading.raw-event/v1"},"source_admission_receipt_id":{"$ref":"#/$defs/ContentID"},"source_id":{"$ref":"#/$defs/bounded_utf8_registry_string"},"source_kind":{"$ref":"#/$defs/bounded_utf8_registry_string"},"source_position":{"additionalProperties":false,"properties":{"event_index":{"maximum":4294967295,"minimum":0,"type":"integer"},"instruction_index":{"maximum":4294967295,"minimum":0,"type":"integer"},"slot":{"$ref":"#/$defs/u64s"},"source_native_event_id":{"$ref":"#/$defs/bounded_utf8_registry_string_256"},"source_subsequence":{"$ref":"#/$defs/u64s"},"transaction_index":{"maximum":4294967295,"minimum":0,"type":"integer"}},"required":["slot","transaction_index","instruction_index","event_index","source_native_event_id","source_subsequence"],"type":"object"},"source_revision":{"$ref":"#/$defs/bounded_utf8_registry_string"},"source_sequence":{"$ref":"#/$defs/u64s"},"venue_profile":{"const":"solana-jupiter-fixture/v1"}},"required":["schema","event_id","fixture_manifest_sha256","raw_payload_sha256","source_admission_receipt_id","source_id","source_kind","source_revision","network","venue_profile","market_id","base_mint","quote_mint","base_decimals","quote_decimals","event_kind","source_position","revision","event_time","observed_at","ingested_at","admission_sequence","source_sequence","ingest_sequence","equal_time_group","replay_clock_ns","executable","market","quality_flags"],"type":"object","x-contract-schema":"trading.raw-event/v1"}
